{
  "hook_event_name": "PostToolUse",
  "cwd": "/home/user/project",
  "model": "gpt-5.5",
  "permission_mode": "default",
  "session_id": "019f0000-aaaa-7000-8000-000000000001",
  "transcript_path": "/home/user/.codex/sessions/2026/07/17/rollout-2026-07-17T00-00-00-019f0000.jsonl",
  "turn_id": "019f0000-bbbb-7000-8000-000000000002",
  "agent_id": "019f0000-cccc-7000-8000-000000000003",
  "agent_type": "worker",
  "tool_name": "shell",
  "tool_input": {
    "command": "node --test"
  },
  "tool_response": {
    "aggregated_output": "ok 12 tests",
    "exit_code": 0
  },
  "tool_use_id": "call_0001"
}
