{
  "session_id": "019f7ba3-31e6-7e10-b4a2-21cb760d927e",
  "turn_id": "019f7ba3-321e-7692-9317-bccd3bac7976",
  "transcript_path": "/Users/user/.codex/sessions/2026/07/19/rollout-2026-07-19T19-28-40-019f7ba3-31e6-7e10-b4a2-21cb760d927e.jsonl",
  "cwd": "/Users/user",
  "hook_event_name": "PostToolUse",
  "model": "gpt-5.6-sol",
  "permission_mode": "bypassPermissions",
  "tool_name": "Bash",
  "tool_input": {
    "command": "echo probe"
  },
  "tool_response": "probe\n",
  "tool_use_id": "exec-1c36d76b-c2ff-4f77-b2c9-91baf0981fd0"
}
